{
  "scoring": {
    "stance_strength": 5,
    "volatility_risk": 6,
    "confidence": 0.65
  },
  "metrics": [
    {
      "name": "S&P 500",
      "value": "6,827.41",
      "signal": "NORMAL"
    },
    {
      "name": "TASI",
      "value": "10,614.71",
      "signal": "NEUTRAL"
    },
    {
      "name": "Oil (Brent)",
      "value": "$57.44",
      "signal": "NORMAL"
    },
    {
      "name": "Gold",
      "value": "$4,328.30",
      "signal": "NORMAL"
    },
    {
      "name": "DXY",
      "value": "98.39",
      "signal": "NORMAL"
    },
    {
      "name": "10Y Yield",
      "value": "4.19%",
      "signal": "NORMAL"
    }
  ],
  "macro": {
    "oil": 57.44,
    "dxy": 98.39,
    "gold": 4328.3,
    "sp500": 6827.41,
    "tasi": 10614.71,
    "treasury_10y": 4.19
  },
  "tasi_mood": "Cautiously Optimistic",
  "drivers": [
    "Global Economic Growth",
    "Oil Prices",
    "Geopolitical Tensions"
  ],
  "ai_analysis": "The global macro environment is characterized by a stance strength of 5, indicating a moderate level of market conviction. The volatility risk is rated at 6, suggesting a heightened state of market uncertainty. The confidence level of 0.65 reflects a cautious optimism among investors. The S&P 500 at 6,827.41 is within normal parameters, indicating stability in the US equity market. The TASI at 10,614.71 shows a neutral signal, reflecting a stable Saudi market. Oil prices at $57.44 are within normal ranges, suggesting stability in the energy sector. Gold prices at $4,328.30 are also normal, indicating a balanced demand for safe-haven assets. The DXY Index at 98.39 reflects a strong US dollar, which may impact global trade and investment flows. The 10Y Treasury Yield at 4.19% is slightly elevated but remains within acceptable limits. The TASI mood is 'Cautiously Optimistic,' driven by global economic growth, oil prices, and geopolitical tensions. Overall, the global macro environment is stable, with potential for increased volatility in the near term.",
  "data_sources": [
    "Bloomberg",
    "Reuters",
    "Saudi Exchange"
  ],
  "last_update": "2025-12-14T10:10:08.208998+00:00",
  "dashboard": "the-map",
  "name": "The Map",
  "role": "Macro",
  "mission": "Extract hawkish/dovish tone, forward pressure, rate path, and macro wind direction."
}