{
  "metrics": [
    {
      "name": "Rotation Strength",
      "value": "6.5",
      "signal": "Bitcoin",
      "percentile": 70
    },
    {
      "name": "Momentum",
      "value": "4.8",
      "signal": "Bearish",
      "percentile": 35
    },
    {
      "name": "Setup Quality",
      "value": "5.5",
      "signal": "Good"
    }
  ],
  "core_metrics": {
    "rotation_strength": 6.5,
    "momentum": 4.8,
    "setup_quality": 5.5
  },
  "market_metrics": {
    "btc_price": "$90,058.21",
    "eth_price": "$3,110.65",
    "rsi_btc": 45.2,
    "eth_btc": 0.0345,
    "fear_and_greed": 21,
    "dxy_index": 98.39,
    "fed_rate": "Hawkish"
  },
  "ai_analysis": "The crypto market is currently experiencing a moderate rotation strength of 6.5, favoring Bitcoin, with a percentile ranking of 70. This indicates that Bitcoin is leading the market, while altcoins are lagging. The momentum signal is bearish at 4.8, with a percentile of 35, suggesting that the overall market momentum is weak. The setup quality is rated as 'Good' at 5.5, indicating that the current market structure is conducive to potential opportunities. Bitcoin's price at $90,058.21 shows a slight decline of 0.27% over the past 24 hours, while Ethereum's price at $3,110.65 has decreased by 0.20%. The RSI for Bitcoin is at 45.2, indicating a neutral to slightly bearish sentiment. The ETH/BTC ratio stands at 0.0345, reflecting a relatively stable relationship between the two largest cryptocurrencies. The Fear & Greed Index at 21 suggests 'Extreme Fear,' which could present buying opportunities for those with a long-term perspective. The DXY Index at 98.39 indicates a strong US dollar, which may put pressure on crypto prices. The Federal Reserve's hawkish stance is likely to influence market dynamics, potentially leading to increased volatility. Overall, the crypto market is in a state of consolidation, with potential for a breakout in either direction, depending on macroeconomic factors and regulatory developments.",
  "last_update": "2025-12-14T10:10:08.208998+00:00",
  "dashboard": "the-coin",
  "name": "The Coin",
  "role": "Crypto Scanner",
  "mission": "Track crypto momentum, rotation, and setup quality."
}