{
  "metrics": [
    {
      "name": "Rotation Strength",
      "value": "4",
      "signal": "Bitcoin",
      "percentile": 40
    },
    {
      "name": "Momentum",
      "value": "3",
      "signal": "Bearish",
      "percentile": 30
    },
    {
      "name": "Setup Quality",
      "value": "5",
      "signal": "Good"
    }
  ],
  "core_metrics": {
    "rotation_strength": 4.0,
    "momentum": 3.0,
    "setup_quality": 5.0
  },
  "market_metrics": {
    "btc_price": "$90,225.38",
    "eth_price": "$3,116.35",
    "rsi_btc": 45.0,
    "fear_and_greed": 40,
    "dxy_index": 102.5,
    "fed_rate": "4.50%"
  },
  "ai_analysis": "The crypto market is currently in a state of consolidation, with Bitcoin and Ethereum experiencing minor declines. The rotation strength indicator suggests a slight bias towards Bitcoin, which is trading at $90,225.38. Ethereum, on the other hand, is trading at $3,116.35, reflecting a more bearish sentiment. The momentum indicator is in the bearish zone, suggesting that the current downtrend could continue in the short term. However, the setup quality indicator is positive, indicating that there are potential opportunities for a reversal. The Relative Strength Index (RSI) for Bitcoin is at 45.0, which is neither overbought nor oversold, suggesting that there is room for movement in either direction. The Fear and Greed Index is at 40, indicating a state of fear among investors. The U.S. Dollar Index (DXY) is at 102.5, reflecting a strong dollar, which could impact the performance of dollar-denominated assets like cryptocurrencies. The Federal Reserve's interest rate is at 4.50%, which could impact both equity and bond markets. In this context, investors should focus on managing risk while identifying potential opportunities for a reversal in the crypto market.",
  "last_update": "2025-12-14T08:26:18.279566+00:00",
  "dashboard": "the-coin",
  "name": "The Coin",
  "role": "Crypto Scanner",
  "mission": "Track crypto momentum, rotation, and setup quality."
}